movieId,title,genres,release_date,runtime,overview
73,Terminator 2: Judgment Day,"Action, Thriller, Science Fiction",1991-07-01,137.0,"Nearly 10 years have passed since Sarah Connor was targeted for termination by a cyborg from the future. Now her son, John, the future leader of the resistance, is the target for a newer, more deadly terminator. Once again, the resistance has managed to send a protector back to attempt to save John and his mother Sarah."
74,Kill Bill: Vol. 2,"Action, Crime, Thriller",2004-04-16,136.0,"The Bride unwaveringly continues on her roaring rampage of revenge against the band of assassins who had tried to kill her and her unborn child. She visits each of her former associates one-by-one, checking off the victims on her Death List Five until there's nothing left to do … but kill Bill."
75,Schindler's List,"Drama, History, War",1993-11-29,195.0,The true story of how businessman Oskar Schindler saved over a thousand Jewish lives from the Nazis while they worked as slaves in his factory during World War II.
76,Superbad,Comedy,2007-08-17,113.0,"High school best buddies are facing separation anxiety as they prepare to go off to college. While attempting to score alcohol for a party with help from a fake ID-toting friend, the guys' evening takes a turn into chaotic territory."
77,The Lord of the Rings: The Return of the King,"Adventure, Fantasy, Action",2003-12-01,201.0,"Aragorn is revealed as the heir to the ancient kings as he, Gandalf and the other members of the broken fellowship struggle to save Gondor from Sauron's forces. Meanwhile, Frodo and Sam bring the ring closer to the heart of Mordor, the dark lord's realm."
78,Good Will Hunting,Drama,1997-12-05,126.0,"Will Hunting has a genius-level IQ but chooses to work as a janitor at MIT. When he solves a difficult graduate-level math problem, his talents are discovered by Professor Gerald Lambeau, who decides to help the misguided youth reach his potential. When Will is arrested for attacking a police officer, Professor Lambeau makes a deal to get leniency for him if he will get treatment from therapist Sean Maguire."
79,One Flew Over the Cuckoo's Nest,Drama,1975-11-18,133.0,"While serving time for insanity at a state mental hospital, implacable rabble-rouser, Randle Patrick McMurphy inspires his fellow patients to rebel against the authoritarian rule of head nurse, Mildred Ratched."
80,The Mummy Returns,"Adventure, Action, Fantasy",2001-04-28,130.0,"Rick and Evelyn O'Connell, along with their 8 year old son Alex, discover the key to the legendary Scorpion King's might, the fabled Bracelet of Anubis. Unfortunately, a newly resurrected Imhotep has designs on the bracelet as well, and isn't above kidnapping its new bearer, Alex, to gain control of Anubis' otherworldly army."
81,Once Upon a Time in the West,Western,1968-12-21,175.0,This classic western masterpiece is an epic film about a widow whose land and life are in danger as the railroad is getting closer and closer to taking them over. A mysterious harmonica player joins forces with a desperado to protect the woman and her land.
82,Trainspotting,"Drama, Crime",1996-02-23,93.0,"Renton, deeply immersed in the Edinburgh drug scene, tries to clean up and get out, despite the allure of the drugs and influence of friends."
83,Pulp Fiction,"Thriller, Crime",1994-09-10,154.0,"A burger-loving hit man, his philosophical partner, a drug-addled gangster's moll and a washed-up boxer converge in this sprawling, comedic crime caper. Their adventures unfurl in three stories that ingeniously trip back and forth in time."
84,Tomorrow Never Dies,"Adventure, Action, Thriller",1997-12-11,119.0,A deranged media mogul is staging international incidents to pit the world's superpowers against each other. Now 007 must take on this evil mastermind in an adrenaline-charged battle to end his reign of terror and prevent global pandemonium.
85,Heat,"Action, Crime, Drama, Thriller",1995-12-15,170.0,"Obsessive master thief, Neil McCauley leads a top-notch crew on various insane heists throughout Los Angeles while a mentally unstable detective, Vincent Hanna pursues him without rest. Each man recognizes and respects the ability and the dedication of the other even though they are aware their cat-and-mouse game may end in violence."
86,Twilight,"Adventure, Fantasy, Drama, Romance",2008-11-20,122.0,"When Bella Swan moves to a small town in the Pacific Northwest to live with her father, she starts school and meets the reclusive Edward Cullen, a mysterious classmate who reveals himself to be a 108-year-old vampire. Despite Edward's repeated cautions, Bella can't help but fall in love with him, a fatal move that endangers her own life when a coven of bloodsuckers try to challenge the Cullen clan."
87,28 Days Later,"Horror, Thriller, Science Fiction",2002-10-31,113.0,"Twenty-eight days after a killer virus was accidentally unleashed from a British research facility, a small group of London survivors are caught in a desperate struggle to protect themselves from the infected. Carried by animals and humans, the virus turns those it infects into homicidal maniacs -- and it's absolutely impossible to contain."
88,Saw,"Horror, Mystery, Crime",2004-10-01,103.0,"Obsessed with teaching his victims the value of life, a deranged, sadistic serial killer abducts the morally wayward. Once captured, they must face impossible choices in a horrific game of survival. The victims must fight to win their lives back, or die trying..."
89,"The Good, the Bad and the Ugly",Western,1966-12-23,161.0,"While the Civil War rages between the Union and the Confederacy, three men – a quiet loner, a ruthless hit man and a Mexican bandit – comb the American Southwest in search of a strongbox containing $200,000 in stolen gold."
90,Mulholland Drive,"Thriller, Drama, Mystery",2001-05-16,147.0,"After a car wreck on the winding Mulholland Drive renders a woman amnesic, she and a perky Hollywood-hopeful search for clues and answers across Los Angeles in a twisting venture beyond dreams and reality."
91,The Thing,"Horror, Mystery, Science Fiction",1982-06-25,109.0,Scientists in the Antarctic are confronted by a shape-shifting alien that assumes the appearance of the people that it kills.
92,Bandidas,"Action, Comedy, Western, Crime",2006-01-18,93.0,"Set in the late 19th century. When a ruthless robber baron takes away everything they cherish, a rough-and-tumble, idealistic peasant and a sophisticated heiress embark on a quest for justice, vengeance…and a few good heists."
93,Forrest Gump,"Comedy, Drama, Romance",1994-07-06,142.0,"A man with a low IQ has accomplished great things in his life and been present during significant historic events - in each case, far exceeding what anyone imagined he could do. Yet, despite all the things he has attained, his one true love eludes him. 'Forrest Gump' is the story of a man who rose above his challenges, and who proved that determination, courage, and love are more important than ability."
94,The Bourne Identity,"Action, Drama, Mystery, Thriller",2002-06-14,119.0,"Wounded to the brink of death and suffering from amnesia, Jason Bourne is rescued at sea by a fisherman. With nothing to go on but a Swiss bank account number, he starts to reconstruct his life, but finds that many people he encounters want him dead. However, Bourne realizes that he has the combat and mental skills of a world-class spy – but who does he work for?"
95,The Shawshank Redemption,"Drama, Crime",1994-09-23,142.0,"Framed in the 1940s for the double murder of his wife and her lover, upstanding banker Andy Dufresne begins a new life at the Shawshank prison, where he puts his accounting skills to work for an amoral warden. During his long stretch in prison, Dufresne comes to be admired by the other inmates -- including an older prisoner named Red -- for his integrity and unquenchable sense of hope."
96,The Prestige,"Drama, Mystery, Thriller",2006-10-19,130.0,"A mysterious story of two magicians whose intense rivalry leads them on a life-long battle for supremacy -- full of obsession, deceit and jealousy with dangerous and deadly consequences."
97,The Departed,"Drama, Thriller, Crime",2006-10-05,151.0,"To take down South Boston's Irish Mafia, the police send in one of their own to infiltrate the underworld, not realizing the syndicate has done likewise. While an undercover cop curries favor with the mob kingpin, a career criminal rises through the police ranks. But both sides soon discover there's a mole among them."
98,Spy Game,"Action, Crime, Thriller",2001-11-18,126.0,"Veteran spy Nathan Muir is on the verge of retiring from the CIA when he learns that his one-time protégé and close friend, Tom Bishop, is a political prisoner sentenced to die in Beijing. Although their friendship has been marred by bad blood and resentment, Muir agrees to take on the most dangerous mission of his career and rescue Bishop."
99,Night at the Museum,"Action, Adventure, Comedy, Family, Fantasy",2006-10-20,108.0,"Chaos reigns at the natural history museum when night watchman Larry Daley accidentally stirs up an ancient curse, awakening Attila the Hun, an army of gladiators, a Tyrannosaurus rex and other exhibits. Larry tries desperately to keep the museum under control, but he's fighting a losing battle until President Teddy Roosevelt comes to the rescue."
100,Lara Croft: Tomb Raider,"Adventure, Fantasy, Action, Thriller",2001-06-11,100.0,"English aristocrat Lara Croft is skilled in hand-to-hand combat and in the middle of a battle with a secret society. The shapely archaeologist moonlights as a tomb raider to recover lost antiquities and meets her match in the evil Powell, who's in search of a powerful relic."
101,Sin City,"Action, Thriller, Crime",2005-04-01,124.0,"Welcome to Sin City. This town beckons to the tough, the corrupt, the brokenhearted. Some call it dark… Hard-boiled. Then there are those who call it home — Crooked cops, sexy dames, desperate vigilantes. Some are seeking revenge, others lust after redemption, and then there are those hoping for a little of both. A universe of unlikely and reluctant heroes still trying to do the right thing in a city that refuses to care."
102,Die Hard,"Action, Thriller",1988-07-15,131.0,"NYPD cop, John McClane's plan to reconcile with his estranged wife is thrown for a serious loop when minutes after he arrives at her office, the entire building is overtaken by a group of terrorists. With little help from the LAPD, wisecracking McClane sets out to single-handedly rescue the hostages and bring the bad guys down."
103,Final Fantasy VII: Advent Children,"Action, Adventure, Animation, Fantasy",2005-07-14,101.0,"Two years have passed since the final battle with Sephiroth. Though Midgar, city of mako, city of prosperity, has been reduced to ruins, its people slowly but steadily walk the road to reconstruction. However, a mysterious illness called Geostigma torments them. With no cure in sight, it brings death to the afflicted, one after another, robbing the people of their fledgling hope."
104,The Brothers Grimm,"Adventure, Fantasy, Action, Comedy, Thriller",2005-08-26,118.0,"Folklore collectors and con artists, Jake and Will Grimm, travel from village to village pretending to protect townsfolk from enchanted creatures and performing exorcisms. However, they are put to the test  when they encounter a real magical curse in a haunted forest with real magical beings, requiring genuine courage."
105,Seven Samurai,"Action, Drama",1954-04-26,207.0,"A samurai answers a village's request for protection after he falls on hard times. The town needs protection from bandits, so the samurai gathers six others to help him teach the people how to defend themselves, and the villagers provide the soldiers with food. A giant battle occurs when 40 bandits attack the village."
106,Bill & Ted's Excellent Adventure,"Adventure, Comedy, Science Fiction",1989-02-17,90.0,"In the small town of San Dimas, a few miles away from Los Angeles, there are two nearly brain dead teenage boys going by the names of Bill S, Preston ESQ. and Ted Theodore Logan, they have a dream together of starting their own rock and roll band called the ""Wyld Stallyns"". Unfortunately, they are still in high school and on the verge of failing out of their school as well, and if they do not pass their upcoming history report, they will be separated as a result of Ted's father sending him to military school. But, what Bill and Ted do not know is that they must stay together to save the future. So, a man from the future named Rufus came to help them pass their report. So, both Bill and Ted decided to gather up historical figures which they need for their report. They are hoping that this will help them pass their report so they can stay together."
107,Into the Wild,"Adventure, Drama",2007-09-11,148.0,"The true story of top student and athlete, Christopher McCandless, who after graduating from Emory University in 1992, abandoned his possessions, gave his entire $24,000 savings account to charity and hitchhiked to Alaska to live in the wilderness."
108,Citizen Kane,"Mystery, Drama",1941-04-30,119.0,"Newspaper magnate, Charles Foster Kane is taken from his mother as a boy and made the ward of a rich industrialist. As a result, every well-meaning, tyrannical or self-destructive move he makes for the rest of his life appears in some way to be a reaction to that deeply wounding event."
109,The Shining,"Horror, Thriller",1980-05-22,144.0,"Jack Torrance accepts a caretaker job at the Overlook Hotel, where he, along with his wife Wendy and their son Danny, must live isolated from the rest of the world for the winter. But they aren't prepared for the madness that lurks within."
110,Shrek 2,"Adventure, Animation, Comedy, Family, Fantasy",2004-05-19,93.0,"Shrek, Fiona and Donkey set off to Far, Far Away to meet Fiona's mother and father. But not everyone is happy. Shrek and the King find it hard to get along, and there's tension in the marriage. The fairy godmother discovers that Shrek has married Fiona instead of her Son Prince Charming and sets about destroying their marriage."
111,Saw II,Horror,2005-10-28,92.0,"When a new murder victim is discovered with all the signs of Jigsaw's hand, Detective Eric Matthews begins a full investigation and apprehends Jigsaw with little effort. But for Jigsaw, getting caught is just another part of his plan. Eight more of his victims are already fighting for their lives and now it's time for Matthews to join the game..."
112,Ghostbusters,"Comedy, Fantasy",1984-06-07,107.0,"After losing their academic posts at a prestigious university, a team of parapsychologists goes into business as proton-pack-toting ""ghostbusters"" who exterminate ghouls, hobgoblins and supernatural pests of all stripes. An ad campaign pays off when a knockout cellist hires the squad to purge her swanky digs of demons that appear to be living in her refrigerator."
113,Zodiac,"Crime, Drama, Mystery, Thriller",2007-03-02,157.0,"The true story of the investigation of 'The Zodiac Killer',  a serial killer who terrified the San Francisco Bay Area, taunting police with his ciphers and letters. The case becomes an obsession for four men as their lives and careers are built and destroyed by the endless trail of clues."
114,National Treasure,"Adventure, Action, Thriller, Mystery",2004-11-19,131.0,"Modern treasure hunters, led by archaeologist Ben Gates, search for a chest of riches rumored to have been stashed away by George Washington, Thomas Jefferson and Benjamin Franklin during the Revolutionary War. The chest's whereabouts may lie in secret clues embedded in the Constitution and the Declaration of Independence, and Gates is in a race to find the gold before his enemies do."
115,DragonHeart,Fantasy,1996-05-31,103.0,"In an ancient time when majestic fire-breathers soared through the skies, a knight named Bowen comes face to face and heart to heart with the last dragon on Earth, Draco. Taking up arms to suppress a tyrant king, Bowen soon realizes his task will be harder than he'd imagined: If he kills the king, Draco will die as well."
116,Planet of the Apes,"Thriller, Science Fiction, Action, Adventure",2001-07-25,119.0,"After a spectacular crash-landing on an uncharted planet, brash astronaut Leo Davidson finds himself trapped in a savage world where talking apes dominate the human race. Desperate to find a way home, Leo must evade the invincible gorilla army led by Ruthless General Thade."
117,Basic Instinct 2,"Crime, Mystery, Thriller",2006-03-29,114.0,"Novelist Catherine Tramell is once again in trouble with the law, and Scotland Yard appoints psychiatrist Dr. Michael Glass to evaluate her. Though, like Detective Nick Curran before him, Glass is entranced by Tramell and lured into a seductive game."
118,Antz,"Adventure, Animation, Comedy, Family",1998-10-02,83.0,"In this animated hit, a neurotic worker ant in love with a rebellious princess rises to unlikely stardom when he switches places with a soldier. Signing up to march in a parade, he ends up under the command of a bloodthirsty general. But he's actually been enlisted to fight against a termite army."
119,Rear Window,"Drama, Mystery, Thriller",1954-08-01,112.0,"Professional photographer L.B. ""Jeff"" Jeffries breaks his leg while getting an action shot at an auto race. Confined to his New York apartment, he spends his time looking out of the rear window observing the neighbors. He begins to suspect that a man across the courtyard may have murdered his wife. Jeff enlists the help of his high society fashion-consultant girlfriend Lisa Freemont and his visiting nurse Stella to investigate."
120,A Real Young Girl,Drama,1976-01-01,93.0,"Bored and restless, Alice spends much of her time lusting after Jim, a local sawmill worker. When not lusting after him, Alice fills the hours with such pursuits as writing her name on a mirror with vaginal secretions and wandering the fields with her underwear around her ankles. And, in true teenaged tradition, she spends a lot of time writing in her diary."
121,Pirates of the Caribbean: On Stranger Tides,"Adventure, Action, Fantasy",2011-05-14,136.0,"Captain Jack Sparrow crosses paths with a woman from his past, and he's not sure if it's love -- or if she's a ruthless con artist who's using him to find the fabled Fountain of Youth. When she forces him aboard the Queen Anne's Revenge, the ship of the formidable pirate Blackbeard, Jack finds himself on an unexpected adventure in which he doesn't know who to fear more: Blackbeard or the woman from his past."
122,Field of Dreams,"Drama, Fantasy",1989-04-21,107.0,"Ray Kinsella is an Iowa farmer who hears a mysterious voice telling him to turn his cornfield into a baseball diamond. He does, but the voice's directions don't stop -- even after the spirits of deceased ballplayers turn up to play."
123,Mary Poppins,"Comedy, Family, Fantasy",1964-08-27,139.0,"The movie combines a diverting story, songs, color and sequences of live action blended with the movements of animated figures. Mary Poppins is a kind of Super-nanny who flies in with her umbrella in response to the request of the Banks children and proceeds to put things right with the aid of her rather extraordinary magical powers before flying off again."
124,Strangers on a Train,"Crime, Drama, Thriller",1951-06-18,101.0,A psychotic socialite confronts a pro tennis star with a theory on how two complete strangers can get away with murder...a theory that he plans to implement.
125,Indiana Jones and the Temple of Doom,"Adventure, Action",1984-05-23,118.0,"After arriving in India, Indiana Jones is asked by a desperate village to find a mystical stone. He agrees – and stumbles upon a secret cult plotting a terrible plan in the catacombs of an ancient palace."
126,The Mummy,"Adventure, Action, Fantasy",1999-04-16,124.0,"Dashing legionnaire Rick O'Connell and his companion, Beni stumble upon the hidden ruins of Hamunaptra while in the midst of a battle in 1923, 3,000 years after Imhotep has suffered a fate worse than death – his body will remain undead for all eternity as a punishment for a forbidden love."
127,Ghostbusters II,"Comedy, Fantasy",1989-06-15,108.0,"Five years after they defeated Gozer, the Ghostbusters are out of business. When Dana begins to have ghost problems again, the boys come out of retirement to aid her and hopefully save New York City from a new paranormal threat."
128,The Dark Knight,"Drama, Action, Crime, Thriller",2008-07-16,152.0,"Batman raises the stakes in his war on crime. With the help of Lt. Jim Gordon and District Attorney Harvey Dent, Batman sets out to dismantle the remaining criminal organizations that plague the streets. The partnership proves to be effective, but they soon find themselves prey to a reign of chaos unleashed by a rising criminal mastermind known to the terrified citizens of Gotham as the Joker."
129,Memento,"Mystery, Thriller",2000-10-11,113.0,"Suffering short-term memory loss after a head injury, Leonard Shelby embarks on a grim quest to find the lowlife who murdered his wife in this gritty, complex thriller that packs more knots than a hangman's noose. To carry out his plan, Shelby snaps Polaroids of people and places, jotting down contextual notes on the backs of photos to aid in his search and jog his memory. He even tattoos his own body in a desperate bid to remember."
130,Jackie Brown,"Comedy, Crime, Romance",1997-12-24,154.0,"Jackie Brown is a flight attendant who gets caught in the middle of smuggling cash into the country for her gunrunner boss. When the cops try to use Jackie to get to her boss, she hatches a plan—with help from a bail bondsman—to keep the money for herself. Based on Elmore Leonard's novel “Rum Punch”."
131,Sin City: A Dame to Kill For,"Crime, Thriller",2014-08-20,102.0,Some of Sin City's most hard-boiled citizens cross paths with a few of its more reviled inhabitants.
132,The Godfather: Part II,"Drama, Crime",1974-12-20,200.0,"In the continuing saga of the Corleone crime family, a young Vito Corleone grows up in Sicily and in 1910s New York. In the 1950s, Michael Corleone attempts to expand the family business into Las Vegas, Hollywood and Cuba."
133,Ice Age,"Animation, Comedy, Family, Adventure",2002-03-10,81.0,"With the impending ice age almost upon them, a mismatched trio of prehistoric critters – Manny the woolly mammoth, Diego the saber-toothed tiger and Sid the giant sloth – find an orphaned infant and decide to return it to its human parents. Along the way, the unlikely allies become friends but, when enemies attack, their quest takes on far nobler aims."
134,Cube²: Hypercube,"Thriller, Science Fiction, Mystery",2002-04-15,94.0,The sequel to the low budget first film ‘Cube.’ This time the prisoners find them selves in a more advanced cube environment that they must escape from before they are killed. A science fiction film where space and time have more than one path.
135,The Flintstones,"Fantasy, Comedy, Family",1994-05-26,91.0,Modern Stone Age family the Flintstones hit the big screen in this live-action version of the classic cartoon. Fred helps Barney adopt a child. Barney sees an opportunity to repay him when Slate Mining tests its employees to find a new executive. But no good deed goes unpunished.
136,Kingdom of Heaven,"Drama, Action, Adventure, History, War",2005-05-03,144.0,"After his wife dies, a blacksmith named Balian is thrust into royalty, political intrigue and bloody holy wars during the Crusades."
137,Die Hard: With a Vengeance,"Action, Thriller",1995-05-19,128.0,"New York detective John McClane is back and kicking bad-guy butt in the third installment of this action-packed series, which finds him teaming with civilian Zeus Carver to prevent the loss of innocent lives. McClane thought he'd seen it all, until a genius named Simon engages McClane, his new ""partner"" -- and his beloved city -- in a deadly game that demands their concentration."
138,Iron Man,"Action, Science Fiction, Adventure",2008-04-30,126.0,"After being held captive in an Afghan cave, billionaire engineer Tony Stark creates a unique weaponized suit of armor to fight evil."
139,Captain America: The First Avenger,"Action, Adventure, Science Fiction",2011-07-22,124.0,"Predominantly set during World War II, Steve Rogers is a sickly man from Brooklyn who's transformed into super-soldier Captain America to aid in the war effort. Rogers must stop the Red Skull – Adolf Hitler's ruthless head of weaponry, and the leader of an organization that intends to use a mysterious device of untold powers for world domination."
140,The Empire Strikes Back,"Adventure, Action, Science Fiction",1980-05-17,124.0,"The epic saga continues as Luke Skywalker, in hopes of defeating the evil Galactic Empire, learns the ways of the Jedi from aging master Yoda. But Darth Vader is more determined than ever to capture Luke. Meanwhile, rebel leader Princess Leia, cocky Han Solo, Chewbacca, and droids C-3PO and R2-D2 are thrown into various stages of capture, betrayal and despair."
141,A Mighty Heart,"Drama, Thriller",2007-01-01,100.0,"Based on Mariane Pearl's account of the terrifying and unforgettable story of her husband, Wall Street Journal reporter Danny Pearl's life and death."
142,The Patriot,"Drama, History, War, Action",2000-06-28,165.0,"After proving himself on the field of battle in the French and Indian War, Benjamin Martin wants nothing more to do with such things, preferring the simple life of a farmer. But when his son Gabriel enlists in the army to defend their new nation, America, against the British, Benjamin reluctantly returns to his old life to protect his son."
143,Open Range,Western,2003-08-29,139.0,A former gunslinger is forced to take up arms again when he and his cattle crew are threatened by a corrupt lawman.
